{"schema_version":2,"report":"pack-show","catalog_state":"current","id":"engram","version":"2.0.0","description":"Persistent memory for agent work","source_identity":{"pack_id":"engram","version":"2.0.0","schema_version":3,"limitation":"Packy records the trusted pack ID, version, and manifest schema, but no upstream source provenance."},"historical_versions":[],"update_routes":[],"surfaces":["claude","codex","opencode"],"provides":["memory:persistent"],"requires":{"capabilities":[],"tools":["engram"]},"conflicts":[],"resource_counts":{"Skills":0,"Instructions":1,"MCPServers":1,"Lifecycles":1,"Agents":0,"Commands":0,"Assets":0,"Notices":0},"surface_contracts":[{"surface":"claude","contract":{"compatibility":"degraded","logical_resource_counts":{"Skills":0,"Instructions":1,"MCPServers":1,"Lifecycles":1,"Agents":0,"Commands":0,"Assets":0,"Notices":0},"dependency_closure":[],"bindings":[{"kind":"instruction","id":"engram-memory","projection":"instruction","name":"engram-memory","invocation":"engram-memory","mode":"native","sharing":"shared"},{"kind":"mcp_server","id":"engram","projection":"mcp_server","name":"engram","invocation":"engram","mode":"native","sharing":"exclusive"}],"exclusions":[{"id":"lifecycle:engram-memory","resource_kind":"lifecycle","surface":"claude","mode":"optional","code":"generic-lifecycle-unsupported","source_paths":[],"reason":"Generic lifecycle translation is unsupported on Claude; Packy uses the native instruction and exact user MCP binding and does not execute `engram setup claude-code`."}],"optional_modes":[],"prompt_authorities":[],"aliases":[],"authority_disclosure":"Activation grants only the sealed local projection actions; later workflow effects require host approval."},"intent":{"state":"absent","active":null,"revision":null,"aliases":[]}},{"surface":"codex","contract":{"compatibility":"complete","logical_resource_counts":{"Skills":0,"Instructions":1,"MCPServers":1,"Lifecycles":1,"Agents":0,"Commands":0,"Assets":0,"Notices":0},"dependency_closure":[],"bindings":[{"kind":"instruction","id":"engram-memory","projection":"instruction","name":"engram-memory","invocation":"engram-memory","mode":"native","sharing":"shared"},{"kind":"lifecycle","id":"engram-memory","projection":"lifecycle","name":"engram-memory","invocation":"engram-memory","mode":"native","sharing":"exclusive"},{"kind":"mcp_server","id":"engram","projection":"mcp_server","name":"engram","invocation":"engram","mode":"native","sharing":"exclusive"}],"exclusions":[],"optional_modes":[],"prompt_authorities":[],"aliases":[],"authority_disclosure":"Activation grants only the sealed local projection actions; later workflow effects require host approval."},"intent":{"state":"absent","active":null,"revision":null,"aliases":[]}},{"surface":"opencode","contract":{"compatibility":"complete","logical_resource_counts":{"Skills":0,"Instructions":1,"MCPServers":1,"Lifecycles":1,"Agents":0,"Commands":0,"Assets":0,"Notices":0},"dependency_closure":[],"bindings":[{"kind":"instruction","id":"engram-memory","projection":"instruction","name":"engram-memory","invocation":"engram-memory","mode":"native","sharing":"shared"},{"kind":"lifecycle","id":"engram-memory","projection":"lifecycle","name":"engram-memory","invocation":"engram-memory","mode":"native","sharing":"exclusive"},{"kind":"mcp_server","id":"engram","projection":"mcp_server","name":"engram","invocation":"engram","mode":"native","sharing":"exclusive"}],"exclusions":[],"optional_modes":[],"prompt_authorities":[],"aliases":[],"authority_disclosure":"Activation grants only the sealed local projection actions; later workflow effects require host approval."},"intent":{"state":"absent","active":null,"revision":null,"aliases":[]}}]}
